{
    "name": "python3",
    "description": "Python interpreter for running Python scripts and modules",
    "command": "python3",
    "enabled": true,
    "timeout_seconds": 300,
    "hints": {
        "default": "Python interpreter ready - consider script execution, module running, or interactive exploration.",
        "script": "Running Python script - monitor output for errors, consider debugging steps, or plan code improvements.",
        "module": "Executing Python module - review module functionality or plan integration steps.",
        "interactive": "Python interactive mode - use for testing code snippets, exploring APIs, or debugging."
    },
    "input_schema": {
        "type": "object",
        "properties": {}
    },
    "subcommand": [
        {
            "name": "script",
            "description": "Execute a Python script file",
            "synchronous": false,
            "options": [
                {
                    "name": "file",
                    "type": "string",
                    "description": "Path to Python script file to execute",
                    "required": true
                },
                {
                    "name": "args",
                    "type": "array",
                    "description": "Arguments to pass to the script"
                },
                {
                    "name": "unbuffered",
                    "type": "boolean",
                    "description": "Force stdout and stderr streams to be unbuffered (-u)"
                },
                {
                    "name": "verbose",
                    "type": "boolean",
                    "description": "Verbose output - trace import statements (-v)"
                },
                {
                    "name": "optimize",
                    "type": "string",
                    "description": "Optimization level: 'O' (remove asserts), 'OO' (remove asserts and docstrings)"
                },
                {
                    "name": "warnings",
                    "type": "string",
                    "description": "Warning control in format action:message:category:module:lineno (-W)"
                }
            ]
        },
        {
            "name": "code",
            "synchronous": true,
            "description": "Execute Python code passed as string",
            "options": [
                {
                    "name": "command",
                    "type": "string",
                    "description": "Python code to execute",
                    "required": true
                },
                {
                    "name": "unbuffered",
                    "type": "boolean",
                    "description": "Force stdout and stderr streams to be unbuffered (-u)"
                },
                {
                    "name": "verbose",
                    "type": "boolean",
                    "description": "Verbose output - trace import statements (-v)"
                },
                {
                    "name": "optimize",
                    "type": "string",
                    "description": "Optimization level: 'O' (remove asserts), 'OO' (remove asserts and docstrings)"
                },
                {
                    "name": "warnings",
                    "type": "string",
                    "description": "Warning control in format action:message:category:module:lineno (-W)"
                }
            ]
        },
        {
            "name": "module",
            "description": "Run library module as a script",
            "synchronous": false,
            "options": [
                {
                    "name": "module_name",
                    "type": "string",
                    "description": "Name of the module to run (e.g., 'json.tool', 'http.server')",
                    "required": true
                },
                {
                    "name": "args",
                    "type": "array",
                    "description": "Arguments to pass to the module"
                },
                {
                    "name": "unbuffered",
                    "type": "boolean",
                    "description": "Force stdout and stderr streams to be unbuffered (-u)"
                },
                {
                    "name": "verbose",
                    "type": "boolean",
                    "description": "Verbose output - trace import statements (-v)"
                },
                {
                    "name": "optimize",
                    "type": "string",
                    "description": "Optimization level: 'O' (remove asserts), 'OO' (remove asserts and docstrings)"
                },
                {
                    "name": "warnings",
                    "type": "string",
                    "description": "Warning control in format action:message:category:module:lineno (-W)"
                }
            ]
        },
        {
            "name": "version",
            "description": "Print Python version and exit",
            "synchronous": true,
            "options": [
                {
                    "name": "detailed",
                    "type": "boolean",
                    "description": "Print detailed build information (-VV)"
                }
            ]
        },
        {
            "name": "help",
            "description": "Print help information",
            "synchronous": true,
            "options": [
                {
                    "name": "help_type",
                    "type": "string",
                    "description": "Type of help: 'general' (default), 'env' (environment variables), 'xoptions' (implementation options), 'all' (complete help)"
                }
            ]
        },
        {
            "name": "interactive",
            "description": "Start interactive Python interpreter",
            "synchronous": false,
            "options": [
                {
                    "name": "inspect",
                    "type": "boolean",
                    "description": "Inspect interactively after running script (-i)"
                },
                {
                    "name": "quiet",
                    "type": "boolean",
                    "description": "Don't print version and copyright messages on startup (-q)"
                },
                {
                    "name": "isolated",
                    "type": "boolean",
                    "description": "Isolate Python from user's environment (-I)"
                },
                {
                    "name": "no_site",
                    "type": "boolean",
                    "description": "Don't imply 'import site' on initialization (-S)"
                },
                {
                    "name": "unbuffered",
                    "type": "boolean",
                    "description": "Force stdout and stderr streams to be unbuffered (-u)"
                },
                {
                    "name": "verbose",
                    "type": "boolean",
                    "description": "Verbose output - trace import statements (-v)"
                },
                {
                    "name": "warnings",
                    "type": "string",
                    "description": "Warning control in format action:message:category:module:lineno (-W)"
                }
            ]
        },
        {
            "name": "check",
            "description": "Check Python script syntax without executing",
            "synchronous": true,
            "options": [
                {
                    "name": "file",
                    "type": "string",
                    "description": "Path to Python script file to check",
                    "required": true
                },
                {
                    "name": "verbose",
                    "type": "boolean",
                    "description": "Verbose output - trace import statements (-v)"
                }
            ]
        }
    ]
}