{
    "name": "cargo_fmt",
    "description": "Format code using rustfmt",
    "command": "cargo",
    "enabled": true,
    "timeout_seconds": 600,
    "hints": {
        "default": "Formatting your code... a great time to think about code style and consistency."
    },
    "subcommand": [
        {
            "name": "default",
            "synchronous": true,
            "description": "Format code using rustfmt.",
            "options": [
                {
                    "name": "check",
                    "type": "boolean",
                    "description": "Check if files are formatted without changing them"
                },
                {
                    "name": "all",
                    "type": "boolean",
                    "description": "Format all packages in the workspace"
                },
                {
                    "name": "manifest-path",
                    "type": "string",
                    "description": "Path to Cargo.toml",
                    "format": "path"
                },
                {
                    "name": "verbose",
                    "type": "boolean",
                    "description": "Use verbose output (-v)"
                },
                {
                    "name": "quiet",
                    "type": "boolean",
                    "description": "Do not print cargo log messages (-q)"
                },
                {
                    "name": "color",
                    "type": "string",
                    "description": "Coloring [possible values: auto, always, never]"
                }
            ]
        }
    ]
}