{
    "name": "cargo_audit",
    "description": "Audit dependencies for security vulnerabilities and run test coverage.",
    "command": "cargo_audit",
    "enabled": true,
    "timeout_seconds": 3600,
    "hints": {
        "default": "Auditing dependencies for security vulnerabilities... an important step for secure software.",
        "test_coverage": "Running test coverage analysis... ensuring code quality."
    },
    "subcommand": [
        {
            "name": "default",
            "description": "**IMPORTANT:** This tool operates asynchronously.\n1. **Immediate Response:** Returns operation_id and status 'started'. This is NOT YET success\n2. **Final Result:** Result pushed automatically via MCP notification when complete.\n\n**Your Instructions:**\n- DO NOT await for the final result.\n- **DO** continue with other tasks that don't depend on this operation.\n- You **MUST** process the future result notification to know if operation succeeded.",
            "options": [
                {
                    "name": "json",
                    "type": "boolean",
                    "description": "Output report in JSON format"
                },
                {
                    "name": "fix",
                    "type": "boolean",
                    "description": "Automatically try to fix vulnerabilities"
                },
                {
                    "name": "stale",
                    "type": "boolean",
                    "description": "Check for stale advisory database"
                },
                {
                    "name": "ignore",
                    "type": "array",
                    "description": "Advisory id to ignore (can be specified multiple times)"
                },
                {
                    "name": "target-arch",
                    "type": "array",
                    "description": "filter vulnerabilities by CPU (default: no filter). Can be specified multiple times"
                },
                {
                    "name": "target-os",
                    "type": "array",
                    "description": "filter vulnerabilities by OS (default: no filter). Can be specified multiple times"
                }
            ]
        },
        {
            "name": "llvm-cov",
            "description": "**IMPORTANT:** This tool operates asynchronously.\n1. **Immediate Response:** Returns operation_id and status 'started'. This is NOT YET success\n2. **Final Result:** Result pushed automatically via MCP notification when complete.\n\n**Your Instructions:**\n- DO NOT await for the final result.\n- **DO** continue with other tasks that don't depend on this operation.\n- You **MUST** process the future result notification to know if operation succeeded.",
            "subcommand": [
                {
                    "name": "nextest",
                    "description": "**IMPORTANT:** This tool operates asynchronously.\n1. **Immediate Response:** Returns operation_id and status 'started'. This is NOT YET success.\n2. **Final Result:** Result pushed automatically via MCP notification when complete.\n\n**Your Instructions:**\n- DO NOT await for the final result.\n- **DO** continue with other tasks that don't depend on this operation.\n- You **MUST** process the future result notification to know if operation succeeded.",
                    "options": [
                        {
                            "name": "html",
                            "type": "boolean",
                            "description": "Generate HTML report"
                        },
                        {
                            "name": "open",
                            "type": "boolean",
                            "description": "Open HTML report in browser"
                        }
                    ]
                },
                {
                    "name": "report",
                    "description": "**IMPORTANT:** This tool operates asynchronously.\n1. **Immediate Response:** Returns operation_id and status 'started'. This is NOT YET success.\n2. **Final Result:** Result pushed automatically via MCP notification when complete.\n\n**Your Instructions:**\n- DO NOT await for the final result.\n- **DO** continue with other tasks that don't depend on this operation.\n- You **MUST** process the future result notification to know if operation succeeded.",
                    "options": [
                        {
                            "name": "summary-only",
                            "type": "boolean",
                            "description": "Generate a summary of the test coverage report"
                        }
                    ]
                }
            ]
        }
    ]
}