{
    "name": "cargo_llvm_cov",
    "description": "LLVM source-based code coverage for Rust projects",
    "command": "cargo",
    "enabled": true,
    "synchronous": true,
    "timeout_seconds": 1800,
    "hints": {
        "default": "Generating coverage reports synchronously. This may take a few minutes for comprehensive analysis."
    },
    "subcommand": [
        {
            "name": "llvm-cov",
            "description": "Run tests and collect coverage data via cargo llvm-cov.",
            "synchronous": true,
            "options": [
                {
                    "name": "html",
                    "type": "boolean",
                    "description": "Generate HTML coverage report"
                },
                {
                    "name": "open",
                    "type": "boolean",
                    "description": "Open HTML report in browser"
                }
            ]
        }
    ]
}