{
    "name": "status",
    "description": "Monitor and query the status of all operations (active, completed, failed) without blocking execution",
    "command": "status",
    "enabled": true,
    "timeout_seconds": 30,
    "hints": {
        "primary": "Real-time operation monitoring tool for tracking concurrent processes",
        "usage": "status (shows all operations), status --operation_id op_123 (specific operation), status --tools cargo,npm (filter by tool prefix)",
        "wait_hint": "Status checks are instantaneous - use while other operations run in the background",
        "default": "Perfect tool for monitoring progress while working on other tasks"
    },
    "subcommand": [
        {
            "name": "run",
            "synchronous": true,
            "description": "Query the status of operations without blocking. Shows active and completed operations with efficiency analysis including concurrency metrics and wait time analysis.",
            "options": [
                {
                    "name": "operation_id",
                    "type": "string",
                    "description": "Specific operation ID to query (optional; shows all if omitted)"
                },
                {
                    "name": "tools",
                    "type": "string",
                    "description": "Comma-separated tool name prefixes to filter by (optional; shows all if omitted)"
                }
            ]
        }
    ]
}