{
    "name": "test_audit",
    "command": "bash scripts/test-audit.sh",
    "description": "**IMPORTANT:** This tool operates asynchronously.\n1. **Immediate Response:** Returns operation_id and status 'started'. This is NOT YET success\n2. **Final Result:** Result pushed automatically via MCP notification when complete.\n\n**Your Instructions:**\n- DO NOT wait for the final result unless you are at end of all tasks and have already updated the user with 'assume success but verify' results.\n- **DO** continue with other tasks that don't depend on this operation\n- You **MUST** process the future result notification to know if operation succeeded\n\nRun the test audit script to generate a coverage report.",
    "subcommand": [
        {
            "name": "default",
            "description": "Run the test audit script.",
            "enabled": true
        }
    ]
}