{
    "name": "test_coverage",
    "command": "bash scripts/test-audit.sh",
    "description": "**IMPORTANT:** This tool operates asynchronously.\n1. **Immediate Response:** Returns operation_id and status 'started'. This is NOT YET success.\n2. **Final Result:** Result pushed automatically via MCP notification when complete.\n\n**Your Instructions:**\n- DO NOT wait for the final result.\n- **DO** continue with other tasks that don't depend on this operation.\n- You **MUST** process the future result notification to know if operation succeeded.\n\nRun the test coverage script.",
    "subcommand": [
        {
            "name": "default",
            "description": "**IMPORTANT:** This tool operates asynchronously.\n1. **Immediate Response:** Returns operation_id and status 'started'. This is NOT YET success.\n2. **Final Result:** Result pushed automatically via MCP notification when complete.\n\n**Your Instructions:**\n- DO NOT wait for the final result.\n- **DO** continue with other tasks that don't depend on this operation.\n- You **MUST** process the future result notification to know if operation succeeded.\n\nRun the test coverage script.",
            "options": [
                {
                    "name": "working_directory",
                    "type": "string",
                    "format": "path",
                    "description": "Working directory for command execution"
                }
            ]
        }
    ]
}