{
    "name": "cargo_bench",
    "description": "Run benchmarks for a Rust project.",
    "command": "cargo",
    "enabled": true,
    "timeout_seconds": 600,
    "subcommand": [
        {
            "name": "bench",
            "guidance_key": "async_behavior",
            "description": "Run benchmarks.",
            "options": [
                {
                    "name": "release",
                    "type": "boolean",
                    "description": "Run benchmarks with release profile"
                },
                {
                    "name": "benchname",
                    "type": "string",
                    "description": "If specified, only run benches containing this string in their names (positional argument)"
                },
                {
                    "name": "args",
                    "type": "array",
                    "description": "Arguments passed to the bench binary (use after '--')"
                },
                {
                    "name": "no-run",
                    "type": "boolean",
                    "description": "Compile, but don't run benchmarks"
                },
                {
                    "name": "no-fail-fast",
                    "type": "boolean",
                    "description": "Run all benchmarks regardless of failure"
                },
                {
                    "name": "message-format",
                    "type": "string",
                    "description": "Error format [possible values: human, short, json, json-diagnostic-short, json-diagnostic-rendered-ansi, json-render-diagnostics]"
                },
                {
                    "name": "verbose",
                    "type": "integer",
                    "description": "Use verbose output (-vv very verbose/build.rs output)"
                },
                {
                    "name": "quiet",
                    "type": "boolean",
                    "description": "Do not print cargo log messages"
                },
                {
                    "name": "color",
                    "type": "string",
                    "description": "Coloring [possible values: auto, always, never]"
                },
                {
                    "name": "config",
                    "type": "string",
                    "description": "Override a configuration value (KEY=VALUE or PATH)",
                    "format": "path-or-value"
                },
                {
                    "name": "unstable",
                    "type": "string",
                    "description": "Unstable (nightly-only) flags to Cargo (use 'cargo -Z help' for details)"
                },
                {
                    "name": "package",
                    "type": "string",
                    "description": "Package to run benchmarks for (-p, --package [<SPEC>])"
                },
                {
                    "name": "workspace",
                    "type": "boolean",
                    "description": "Benchmark all packages in the workspace"
                },
                {
                    "name": "exclude",
                    "type": "array",
                    "description": "Exclude packages from the benchmark (can be specified multiple times)"
                },
                {
                    "name": "all",
                    "type": "boolean",
                    "description": "Alias for --workspace (deprecated)"
                },
                {
                    "name": "lib",
                    "type": "boolean",
                    "description": "Benchmark only this package's library"
                },
                {
                    "name": "bins",
                    "type": "boolean",
                    "description": "Benchmark all binaries"
                },
                {
                    "name": "bin",
                    "type": "string",
                    "description": "Benchmark only the specified binary"
                },
                {
                    "name": "examples",
                    "type": "boolean",
                    "description": "Benchmark all examples"
                },
                {
                    "name": "example",
                    "type": "string",
                    "description": "Benchmark only the specified example"
                },
                {
                    "name": "tests",
                    "type": "boolean",
                    "description": "Benchmark all targets that have `test = true` set"
                },
                {
                    "name": "test",
                    "type": "string",
                    "description": "Benchmark only the specified test target"
                },
                {
                    "name": "benches",
                    "type": "boolean",
                    "description": "Benchmark all targets that have `bench = true` set"
                },
                {
                    "name": "bench-target",
                    "type": "string",
                    "description": "Benchmark only the specified bench target (--bench <NAME>)"
                },
                {
                    "name": "all-targets",
                    "type": "boolean",
                    "description": "Benchmark all targets"
                },
                {
                    "name": "features",
                    "type": "string",
                    "description": "Space or comma separated list of features to activate"
                },
                {
                    "name": "all-features",
                    "type": "boolean",
                    "description": "Activate all available features"
                },
                {
                    "name": "no-default-features",
                    "type": "boolean",
                    "description": "Do not activate the `default` feature"
                },
                {
                    "name": "jobs",
                    "type": "integer",
                    "description": "Number of parallel jobs, defaults to # of CPUs (-j, --jobs <N>)"
                },
                {
                    "name": "profile",
                    "type": "string",
                    "description": "Build artifacts with the specified profile"
                },
                {
                    "name": "target",
                    "type": "string",
                    "description": "Build for the target triple"
                },
                {
                    "name": "target-dir",
                    "type": "string",
                    "description": "Directory for all generated artifacts",
                    "format": "path"
                },
                {
                    "name": "unit-graph",
                    "type": "boolean",
                    "description": "Output build graph in JSON (unstable)"
                },
                {
                    "name": "timings",
                    "type": "string",
                    "description": "Timing output formats (unstable) (comma separated): html, json"
                },
                {
                    "name": "manifest-path",
                    "type": "string",
                    "description": "Path to Cargo.toml",
                    "format": "path"
                },
                {
                    "name": "lockfile-path",
                    "type": "string",
                    "description": "Path to Cargo.lock (unstable)",
                    "format": "path"
                },
                {
                    "name": "ignore-rust-version",
                    "type": "boolean",
                    "description": "Ignore `rust-version` specification in packages"
                },
                {
                    "name": "locked",
                    "type": "boolean",
                    "description": "Assert that `Cargo.lock` will remain unchanged"
                },
                {
                    "name": "offline",
                    "type": "boolean",
                    "description": "Run without accessing the network"
                },
                {
                    "name": "frozen",
                    "type": "boolean",
                    "description": "Equivalent to specifying both --locked and --offline"
                }
            ]
        }
    ]
}