{
    "name": "pwd",
    "description": "Print working directory commands",
    "command": "pwd",
    "enabled": true,
    "guidance_key": "sync_behavior",
    "subcommand": [
        {
            "name": "default",
            "description": "Print the current working directory - returns immediately.",
            "synchronous": true,
            "options": [
                {
                    "name": "working_directory",
                    "type": "string",
                    "description": "Working directory for command execution",
                    "format": "path"
                }
            ]
        }
    ]
}